{
  "name": "namespace",
  "version": "0.1.0",
  "sources": {
    "dir" : "src",
    "subdirs" : true
  },
  "namespace": "Foo_bar",
  "package-specs":{
    "module": "commonjs",
    "in-source": true
  },
  "bsc-flags" : ["-bs-no-version-header"],
  "bs-dependencies": [],
  "warnings": {
    "number" : "-40+6+7"
  },
  "suffix": ".bs.js"
}
