{
  "reanalyze": {
    "analysis": ["dce"],
    "suppress": [],
    "unsuppress": []
  },
  "name": "sample-typescript-app",
  "bsc-flags": ["-bs-super-errors -w a"],
  "reason": { "react-jsx": 3 },
  "bs-dependencies": ["@rescript/react", "@glennsl/bs-json"],
  "sources": [
    {
      "dir": "src",
      "subdirs": true
    }
  ],
  "package-specs": {
    "module": "es6",
    "in-source": true
  }
}
