{
  "name": "rescript-tests",
  "sources": [
    {
      "dir": "src",
      "subdirs": true
    }
  ],
  "package-specs": {
    "module": "esmodule",
    "in-source": true,
    "suffix": ".mjs"
  },
  "bsc-flags": [
    "-w -3-6-21-26-27-29-30-32..40-44-45-52-60-9-106+104",
    "-warn-error A"
  ]
}
