{
  "name": "tryit",
  "sources": "src",
  "bsc-flags": ["-bs-super-errors", "-open Belt"],
  "warnings": {
    "number": "-32-26-27-33"
  },
  "bs-dependencies": ["reason-react"],
  "reason": { "react-jsx": 3 },
  "namespace": "my-namespace",
  "reanalyze": {
    "analysis": ["dce", "exception"]
  }
}
