{
  "gentypeconfig": {
    "language": "typescript",
    "module": "es6",
    "importPath": "relative",
    "shims": {
      "Js": "Js",
      "ReactEvent": "ReactEvent",
      "RescriptPervasives": "RescriptPervasives",
      "ReasonReact": "ReactShim"
    },
    "debug": {
      "all": false
    },
    "exportInterfaces": false
  },
  "name": "sample-typescript-app",
  "bsc-flags": [],
  "jsx": { "version": 3 },
  "bs-dependencies": ["@rescript/react"],
  "sources": [
    {
      "dir": "src",
      "subdirs": true
    }
  ],
  "uncurried": false,
  "package-specs": {
    "module": "es6",
    "in-source": true
  },
  "suffix": ".bs.js"
}
